{
  "id": 84,
  "code": "item-est-084",
  "set_id": "set_1",
  "area": "Estadística y Probabilidad",
  "area_id": "statistics",
  "topic": "Medidas de posición",
  "spec": {
    "block": "3. Estadística y Probabilidad",
    "affirmation": "A1",
    "affirmation_desc": "Resuelve problemas, de diversos contextos, relacionados con medidas de posición de un grupo de datos cuantitativos o cualitativos.",
    "evidence": "A1.2",
    "evidence_desc": "Interpreta la información que proporcionan algunas medidas de posición (moda, media aritmética, mediana, cuartiles, el máximo o el mínimo) de un grupo de datos resumido en situaciones de diversos contextos."
  },
  "evidence_id": "A1.2",
  "concept_id": "mep-est-medidas-posicion-01",
  "linked_concepts": [
    "mep-est-medidas-posicion-01"
  ],
  "program_applicability": [
    "EDAD_PARTE_1",
    "BXM"
  ],
  "calculator_allowed": true,
  "cognitive_level": "conexion",
  "difficulty_tier": 2,
  "historical_convocatoria": [
    "2026-c2"
  ],
  "stem": "Considere la información de los diagramas de caja sobre las edades de los empleados de dos empresas, A y B.\n\n[Ver diagramas de caja]\n\nEntre ambas empresas, ¿cuántos años tiene el empleado de menor edad?",
  "options": {
    "A": "45",
    "B": "33",
    "C": "23",
    "D": "19"
  },
  "correct_answer": "D",
  "solution_steps": [
    "Se observan los valores mínimos de ambos diagramas de caja.",
    "El mínimo de la empresa A es 23 años.",
    "El mínimo de la empresa B es 19 años.",
    "El empleado de menor edad entre ambas empresas tiene 19 años."
  ],
  "group_id": "g_emp_ages",
  "visual_spec": null
}