{
  "id": 168,
  "code": "item-est-168",
  "set_id": "set_4",
  "area": "Estadística y Probabilidad",
  "area_id": "statistics",
  "topic": "Probabilidad Condicional",
  "spec": {
    "block": "3. Estadística y Probabilidad",
    "affirmation": "A11",
    "evidence": "A11.4",
    "evidence_desc": "Calcula probabilidades a partir de tablas de contingencia."
  },
  "evidence_id": "A11.4",
  "concept_id": "mep-est-eventos-probabilidad-02",
  "linked_concepts": [
    "mep-est-eventos-probabilidad-02"
  ],
  "program_applicability": [
    "EDAD_PARTE_1",
    "BXM"
  ],
  "calculator_allowed": true,
  "cognitive_level": "conexion",
  "difficulty_tier": 2,
  "historical_convocatoria": [
    "2026-c2"
  ],
  "stem": "Considere la siguiente tabla de contingencia sobre las preferencias de deporte según género en un club deportivo: Si se elige una persona al azar y resulta ser mujer, ¿cuál es la probabilidad de que prefiera el Tenis?",
  "options": {
    "A": "$\\frac{20}{40} = 0.50$",
    "B": "$\\frac{20}{80} = 0.25$",
    "C": "$\\frac{20}{30} \\approx 0.67$",
    "D": "$\\frac{30}{80} = 0.375$"
  },
  "correct_answer": "A",
  "solution_steps": [
    "Se trata de una probabilidad condicional $P(\\text{Tenis} \\mid \\text{Mujer})$.",
    "El espacio muestral reducido a las mujeres es de 40 personas.",
    "De las 40 mujeres, 20 prefieren Tenis.",
    "Por lo tanto, $P(\\text{Tenis} \\mid \\text{Mujer}) = \\frac{20}{40} = 0.50$."
  ],
  "group_id": null,
  "visual_spec": {
    "alt": "Tabla de contingencia género vs deporte",
    "visual": {
      "type": "table",
      "variant": "contingency",
      "headers": [
        "Género",
        "Fútbol",
        "Tenis",
        "Total"
      ],
      "rows": [
        [
          "Hombres",
          "30",
          "10",
          "40"
        ],
        [
          "Mujeres",
          "20",
          "20",
          "40"
        ],
        [
          "Total",
          "50",
          "30",
          "80"
        ]
      ]
    }
  }
}