{
  "id": 157,
  "code": "item-geo-157",
  "set_id": "set_4",
  "area": "Geometría",
  "area_id": "geometry",
  "topic": "Polígonos",
  "spec": {
    "block": "1. Geometría",
    "affirmation": "A2",
    "evidence": "A2.3",
    "evidence_desc": "Calcula diagonales y suma de ángulos de polígonos."
  },
  "evidence_id": "A2.3",
  "concept_id": "mep-geo-poligono-regular-07",
  "linked_concepts": [
    "mep-geo-poligono-regular-07"
  ],
  "program_applicability": [
    "EDAD_PARTE_1",
    "BXM"
  ],
  "calculator_allowed": true,
  "cognitive_level": "reproduccion",
  "difficulty_tier": 1,
  "historical_convocatoria": [
    "2026-c2"
  ],
  "stem": "El número total de diagonales que se pueden trazar en un polígono convexo de 10 lados (decágono) es",
  "options": {
    "A": "35",
    "B": "45",
    "C": "20",
    "D": "50"
  },
  "correct_answer": "A",
  "solution_steps": [
    "La fórmula para el número total de diagonales de un polígono de $n$ lados es $D = \\frac{n(n - 3)}{2}$.",
    "Para $n = 10$: $D = \\frac{10(10 - 3)}{2} = \\frac{10 \\cdot 7}{2} = \\frac{70}{2} = 35$.",
    "Por lo tanto, se pueden trazar 35 diagonales."
  ],
  "group_id": null,
  "visual_spec": null
}