{
  "id": 149,
  "code": "item-est-149",
  "set_id": "set_3",
  "area": "Estadística y Probabilidad",
  "area_id": "statistics",
  "topic": "Probabilidad Eventos",
  "spec": {
    "block": "3. Estadística y Probabilidad",
    "affirmation": "A11",
    "affirmation_desc": null,
    "evidence": "A11.2",
    "evidence_desc": "Identifica eventos mutuamente excluyentes y complementarios."
  },
  "evidence_id": "A11.2",
  "concept_id": "mep-est-eventos-probabilidad-02",
  "linked_concepts": [
    "mep-est-eventos-probabilidad-02"
  ],
  "program_applicability": [
    "EDAD_PARTE_1",
    "BXM"
  ],
  "calculator_allowed": true,
  "cognitive_level": "reproduccion",
  "difficulty_tier": 1,
  "historical_convocatoria": [
    "2026-c2"
  ],
  "stem": "Considere el experimento de lanzar un dado transparente estándar de seis caras numeradas del 1 al 6. Sean los eventos $E_1$: obtener un número par y $E_2$: obtener un número impar. ¿Cómo se clasifican los eventos $E_1$ y $E_2$?",
  "options": {
    "A": "Eventos independientes únicamente",
    "B": "Eventos mutuamente excluyentes y complementarios",
    "C": "Eventos imposibles",
    "D": "Eventos seguros"
  },
  "correct_answer": "B",
  "solution_steps": [
    "Espacio muestral $S = \\{1, 2, 3, 4, 5, 6\\}$.",
    "$E_1 = \\{2, 4, 6\\}$ y $E_2 = \\{1, 3, 5\\}$.",
    "Dado que $E_1 \\cap E_2 = \\emptyset$, los eventos no tienen elementos en común, por lo que son MUTUAMENTE EXCLUYENTES.",
    "Dado que $E_1 \\cup E_2 = S$, la unión de ambos cubre todo el espacio muestral, por lo que son COMPLEMENTARIOS."
  ],
  "group_id": null,
  "visual_spec": null
}