{
  "id": 61,
  "code": "item-alg-061",
  "set_id": "set_1",
  "area": "Relaciones y Álgebra",
  "area_id": "functions",
  "topic": "Sistemas de dos ecuaciones lineales con dos incógnitas",
  "spec": {
    "block": "2. Relaciones y Álgebra",
    "affirmation": "A3",
    "affirmation_desc": null,
    "evidence": "A3.3",
    "evidence_desc": "Resuelve problemas, de diversos contextos (reales), relacionados con sistemas de dos ecuaciones con dos incógnitas."
  },
  "evidence_id": "A3.3",
  "concept_id": "mep-alg-sistemas-ecuaciones-05",
  "linked_concepts": [
    "mep-alg-sistemas-ecuaciones-05"
  ],
  "program_applicability": [
    "EDAD_PARTE_1",
    "BXM"
  ],
  "calculator_allowed": true,
  "cognitive_level": "reproduccion",
  "difficulty_tier": 1,
  "historical_convocatoria": [
    "2026-c2"
  ],
  "stem": "Roy y Rosa fueron de compras. Él compró 5 kg de zanahoria y 3 kg de brócoli y por esa compra pagó 4650 en total; mientras que ella compró 3 kg de zanahoria y 5 kg de brócoli y pagó 5350 en total. Si ambos compraron a los mismos precios, entonces, ¿cuánto costó el kilogramo de brócoli?",
  "options": {
    "A": "700",
    "B": "800",
    "C": "625",
    "D": "900"
  },
  "correct_answer": "B",
  "solution_steps": [
    "Sea z = precio del kg de zanahoria y b = precio del kg de brócoli.",
    "Sistema:\n5z + 3b = 4650\n3z + 5b = 5350",
    "Multiplicando la primera ecuación por 3 y la segunda por 5:\n15z + 9b = 13 950\n15z + 25b = 26 750",
    "Restando la primera de la segunda:\n16b = 12 800",
    "b = 800",
    "Por lo tanto, el kilogramo de brócoli costó 800.",
    "Respuesta: B."
  ],
  "group_id": null,
  "visual_spec": null
}