{
  "id": 14,
  "code": "item-geo-014",
  "set_id": "set_1",
  "area": "Geometría",
  "area_id": "geometry",
  "topic": "Polígonos regulares",
  "spec": {
    "block": "1. Geometría",
    "affirmation": "A4",
    "affirmation_desc": null,
    "evidence": "A4.1",
    "evidence_desc": "Determina elementos de los polígonos regulares para la obtención de perímetros o áreas de estos en diversos contextos."
  },
  "evidence_id": "A4.1",
  "concept_id": "mep-geo-poligono-regular-07",
  "linked_concepts": [
    "mep-geo-poligono-regular-07"
  ],
  "program_applicability": [
    "EDAD_PARTE_1",
    "BXM"
  ],
  "calculator_allowed": true,
  "cognitive_level": "conexion",
  "difficulty_tier": 2,
  "historical_convocatoria": [
    "2026-c2"
  ],
  "stem": "Si la medida del ángulo interno de un polígono regular es $120^\\circ$ y la apotema $2\\sqrt{3}$, entonces, ¿cuál es el perímetro de dicho polígono?",
  "options": {
    "A": "12",
    "B": "15",
    "C": "20",
    "D": "24"
  },
  "correct_answer": "D",
  "solution_steps": [
    "Ángulo interno = 120° → 180(n-2)/n = 120 → 180n - 360 = 120n → 60n = 360 → n = 6 (hexágono).",
    "La apotema a = 2√3. Para un hexágono regular, la apotema se relaciona con el lado L: a = L√3/2.",
    "2√3 = L√3/2 → L = 4.",
    "Perímetro = 6 × 4 = 24.",
    "Opción correcta: D."
  ],
  "group_id": null,
  "visual_spec": null
}